{
  "schemaVersion": "1.0.0",
  "title": "Ecosystem Security — The Shield capability model",
  "mission": "The horizontal security authority for the Ecosystem: defining security rules, reusable baselines, assurance semantics, and the evidence required to justify security claims.",
  "currentState": "The Shield is at an early foundation stage. Strong Room v1 is the only implemented reusable capability; all other status labels describe repository maturity, not ecosystem-wide deployment or compliance.",
  "authority": {
    "owns": [
      "security rules and principles",
      "canonical security controls and assessment semantics",
      "security policies and standards",
      "reusable security baselines, including Strong Room",
      "security assurance and evidence semantics",
      "security exception governance"
    ],
    "doesNotOwn": [
      "the canonical repository, service, or infrastructure inventory",
      "application-specific configuration, authorization, threat models, or evidence",
      "production runtime state or deployment operations",
      "provider credentials, secrets, or identity enrollment material",
      "operational responsibilities assigned to application, infrastructure, or service owners"
    ]
  },
  "productionAuthorization": {
    "invariant": "technical validation != authorization",
    "rule": "A human approval gate is required immediately before every production-impacting change.",
    "prohibitedInference": "Tests, checks, CI results, agents, and AI-generated recommendations are evidence inputs only and must never be treated as authorization."
  },
  "statusModel": {
    "PLANNED": "Intended capability with no maintained implementation or governing foundation yet.",
    "FOUNDATION": "Canonical structure, semantics, or requirements exist, but the capability is not operational.",
    "PARTIAL": "A bounded subset exists; uncovered scope remains explicit.",
    "IMPLEMENTED": "A maintained Shield-owned capability exists for its stated scope; this does not prove adoption or effectiveness elsewhere.",
    "VERIFIED": "Current evidence demonstrates the stated scope and provenance. Verification is bounded, dated, and never inferred from documentation."
  },
  "actionabilityModel": {
    "ROADMAP": "Informational architecture only; there is no operational action in the Shield.",
    "GOVERNANCE": "A Shield governance artifact or model can be used, but it is not an operational service.",
    "AVAILABLE": "A bounded Shield-owned reusable capability is available for adoption and independent verification."
  },
  "assessmentStates": {
    "PASS": "The scoped expected behavior was actually observed.",
    "FAIL": "A performed assessment contradicted its expectation.",
    "BLOCKED": "The assessment could not finish because a prerequisite, authorization, or access was missing.",
    "NOT_TESTED": "No assessment attempt has been made.",
    "TECHNICALLY_UNAVAILABLE": "The environment lacks the technical capability; record proof and coverage impact. This is not PASS."
  },
  "integrationBoundaries": [
    {
      "id": "ecosystem-dna",
      "name": "Ecosystem Framework / The DNA",
      "provides": "ecosystem principles, governance context, and canonical cross-domain conventions",
      "shieldRelationship": "The Shield specializes ecosystem rules into security requirements without duplicating the framework."
    },
    {
      "id": "foundation-systems",
      "name": "Foundation Systems",
      "provides": "shared platform and foundational service state",
      "shieldRelationship": "The Shield defines security expectations and consumes scoped state or evidence through future integrations."
    },
    {
      "id": "infrastructure",
      "name": "Infrastructure",
      "provides": "network, host, cloud, backup, and runtime state",
      "shieldRelationship": "Infrastructure implements and operates its controls; the Shield defines requirements and assurance semantics."
    },
    {
      "id": "core-intelligence",
      "name": "Core and Intelligence",
      "provides": "application and decision-support capabilities",
      "shieldRelationship": "They adopt Shield controls and retain their own sensitive configuration, risks, and evidence."
    },
    {
      "id": "ecosystem-control",
      "name": "Ecosystem Control — The Brain",
      "provides": "canonical ecosystem inventory, coordination, and presentation of ecosystem state",
      "shieldRelationship": "Control may display security state, but it does not replace Shield authority or become the only alert path."
    },
    {
      "id": "application-repositories",
      "name": "Application and service repositories",
      "provides": "implementation, populated configuration, deployment state, and application-specific evidence",
      "shieldRelationship": "Applications reference the adopted Shield baseline and keep their populated configuration and evidence locally."
    }
  ],
  "groups": [
    { "id": "GOVERN", "name": "Govern", "purpose": "Set security direction, ownership, mandatory rules, risk decisions, and accountable exceptions." },
    { "id": "IDENTIFY", "name": "Identify", "purpose": "Understand protected scope, data, threats, attack surfaces, and external dependencies." },
    { "id": "PROTECT", "name": "Protect", "purpose": "Provide preventive requirements and reusable safeguards for identities, applications, infrastructure, and delivery." },
    { "id": "DETECT", "name": "Detect", "purpose": "Define observable security signals, findings, validation, and detection coverage." },
    { "id": "RESPOND", "name": "Respond", "purpose": "Coordinate incidents, escalation, evidence preservation, and corrective action." },
    { "id": "RECOVER_ASSURE", "name": "Recover & Assure", "purpose": "Restore securely and turn evidence into bounded, reviewable assurance and continuous improvement." }
  ],
  "roadmapPhases": [
    { "id": 1, "name": "Governance Foundation", "outcomes": ["security principles and ownership", "canonical capability model", "policy and standards structure", "minimum baseline", "control and evidence semantics"] },
    { "id": 2, "name": "Identity & Secrets", "outcomes": ["human, service, and workload identity governance", "MFA and passkeys", "privileged access", "secrets and credential lifecycle"] },
    { "id": 3, "name": "Threat & Architecture Security", "outcomes": ["threat models and asset links", "trust boundaries and attack surfaces", "network exposure", "Strong Room expansion", "hardening baselines"] },
    { "id": 4, "name": "Detection & Response", "outcomes": ["security logging and monitoring", "detections and alerts", "incident lifecycle", "escalation and forensic readiness"] },
    { "id": 5, "name": "Assurance", "outcomes": ["vulnerability management", "automated controls and security testing", "evidence and audits", "framework mappings", "release and deployment attestations"] },
    { "id": 6, "name": "Continuous Security Governance", "outcomes": ["recurring reviews and metrics", "exception and evidence expiry", "control drift", "maturity assessment", "continuous improvement"] }
  ],
  "capabilities": [
    {
      "id": "security-governance",
      "name": "Security Governance",
      "group": "GOVERN",
      "purpose": "Establish accountable security ownership, decision authority, reviews, approvals, reporting, and assurance across the Ecosystem.",
      "scope": "Principles; roles and responsibilities; policy, control, and risk ownership; decision and approval processes; periodic reviews; KPIs/KRIs; maturity and governance evidence.",
      "status": "FOUNDATION",
      "actionability": "GOVERNANCE",
      "owner": "Ecosystem Security — The Shield",
      "subCapabilities": ["security principles", "ownership and RACI", "decision and approval authority", "security reviews", "assurance", "decision records", "KPIs/KRIs and reporting", "periodic governance review"],
      "expectedPolicies": ["Security Governance Policy", "Security Review and Approval Policy"],
      "expectedStandards": ["security ownership standard", "security decision record standard", "governance review cadence"],
      "expectedControls": ["named requirement and risk owners", "documented approval authority", "scheduled governance review", "traceable security decisions"],
      "expectedEvidence": ["approved decision records", "review minutes", "ownership records", "dated KPI/KRI reports", "assurance findings"],
      "dependencies": ["security-controls", "evidence-assurance", "security-risk-management", "security-policy-management", "security-exceptions"],
      "roadmapPhase": 1,
      "futureAutomation": ["ownership gap detection", "review reminders", "KPI/KRI aggregation", "governance reporting"],
      "links": ["../README.md", "../docs/security-capability-architecture.md"]
    },
    {
      "id": "security-policy-management",
      "name": "Security Policy Management",
      "group": "GOVERN",
      "purpose": "Maintain an approved, versioned, owned, and reviewable catalogue of security policies.",
      "scope": "Policy ID, owner, scope, effective date, version, review date, approval state, supersession, exceptions, linked standards, controls, and evidence.",
      "status": "PLANNED",
      "actionability": "ROADMAP",
      "owner": "Ecosystem Security — The Shield",
      "subCapabilities": ["policy catalogue", "versioning and supersession", "approval workflow", "review dates", "policy-to-standard and policy-to-control links"],
      "expectedPolicies": ["Access Control", "Secrets Management", "Incident Response", "Vulnerability Management", "Secure Development", "Logging and Monitoring", "Data Security", "Backup and Recovery Security", "Change and Deployment Security", "Third-Party Security"],
      "expectedStandards": ["policy metadata standard", "policy lifecycle standard"],
      "expectedControls": ["named policy owner", "human approval", "effective and review dates", "superseded policy retention"],